{
 "$schema": "https://json-schema.org/draft/2020-12/schema",
 "$id": "https://nightscout.dev/schemas/entries.read.permissive.json",
 "title": "Nightscout entries (read, permissive)",
 "description": "Generated by tools/nsschema/emit/jsonschema_emit.py from aid-entries-2025.yaml reconciled against reports/schema-census/entries.census.json. Do not edit by hand.",
 "type": "object",
 "properties": {
  "_id": {
   "type": "string",
   "description": "Storage key Nightscout assigns. API v3 does not return it and",
   "x-sensitivity": "identifying",
   "x-data-category": "identity"
  },
  "app": {
   "type": "string",
   "description": "Origin application identifier",
   "x-sensitivity": "identifying",
   "x-data-category": "vocabulary"
  },
  "date": {
   "type": "number",
   "description": "Epoch milliseconds timestamp.",
   "x-sensitivity": "quasi-identifying",
   "x-data-category": "temporal"
  },
  "dateString": {
   "type": "string",
   "description": "ISO 8601 timestamp",
   "x-sensitivity": "quasi-identifying",
   "x-data-category": "temporal",
   "format": "date-time"
  },
  "delta": {
   "type": "number",
   "description": "Change from previous reading (mg/dL).",
   "x-sensitivity": "descriptive",
   "x-data-category": "health-derived"
  },
  "device": {
   "type": "string",
   "description": "Source device identifier. Format varies by uploader.",
   "x-sensitivity": "quasi-identifying",
   "x-data-category": "device"
  },
  "direction": {
   "type": "string",
   "description": "Glucose trend direction. Maps to rate of change:",
   "x-sensitivity": "descriptive",
   "x-data-category": "vocabulary",
   "x-observed-values": [
    "DoubleDown",
    "DoubleUp",
    "Flat",
    "FortyFiveDown",
    "FortyFiveUp",
    "NONE",
    "SingleDown",
    "SingleUp"
   ]
  },
  "filtered": {
   "type": "number",
   "description": "Filtered raw sensor value. Used for calibration algorithms.",
   "x-sensitivity": "descriptive",
   "x-data-category": "health-measurement"
  },
  "identifier": {
   "type": "string",
   "description": "The record's sync identity, assigned by the client and the same on",
   "x-sensitivity": "identifying",
   "x-data-category": "identity"
  },
  "intercept": {
   "type": "number",
   "description": "Calibration intercept (for type=cal)",
   "x-sensitivity": "identifying",
   "x-data-category": "vocabulary"
  },
  "isCalibration": {
   "type": "boolean",
   "description": "Marks a reading produced by, or immediately following, a sensor",
   "x-sensitivity": "descriptive",
   "x-data-category": "therapy-setting"
  },
  "isReadOnly": {
   "type": "boolean",
   "description": "Lock document permanently (HTTP 422 on modify attempts)",
   "x-sensitivity": "identifying",
   "x-data-category": "vocabulary"
  },
  "isValid": {
   "type": "boolean",
   "description": "Soft-delete flag. false = document is deleted.",
   "x-sensitivity": "identifying",
   "x-data-category": "vocabulary"
  },
  "mbg": {
   "type": "number",
   "description": "Meter blood glucose value in mg/dL.",
   "x-sensitivity": "descriptive",
   "x-data-category": "health-measurement"
  },
  "modifiedBy": {
   "type": "string",
   "description": "Last modifier identifier",
   "x-sensitivity": "identifying",
   "x-data-category": "identity"
  },
  "noise": {
   "type": "integer",
   "description": "Signal quality indicator:",
   "x-sensitivity": "descriptive",
   "x-data-category": "health-measurement",
   "minimum": 0,
   "maximum": 5
  },
  "rssi": {
   "type": "integer",
   "description": "Signal strength indicator (dBm)",
   "x-sensitivity": "descriptive",
   "x-data-category": "vocabulary"
  },
  "scale": {
   "type": "number",
   "description": "Calibration scale factor (for type=cal)",
   "x-sensitivity": "identifying",
   "x-data-category": "therapy-setting"
  },
  "sgv": {
   "type": "number",
   "description": "Sensor glucose value in mg/dL.",
   "x-sensitivity": "descriptive",
   "x-data-category": "health-measurement"
  },
  "slope": {
   "type": "number",
   "description": "Calibration slope (for type=cal)",
   "x-sensitivity": "identifying",
   "x-data-category": "vocabulary"
  },
  "srvCreated": {
   "type": "integer",
   "description": "Server creation timestamp (epoch ms)",
   "x-sensitivity": "identifying",
   "x-data-category": "temporal"
  },
  "srvModified": {
   "type": "integer",
   "description": "Server modification timestamp (epoch ms)",
   "x-sensitivity": "identifying",
   "x-data-category": "temporal"
  },
  "subject": {
   "type": "string",
   "description": "Creating user/token identifier",
   "x-sensitivity": "identifying",
   "x-data-category": "identity"
  },
  "sysTime": {
   "type": "string",
   "description": "System time when reading was captured (Dexcom Share)",
   "x-sensitivity": "quasi-identifying",
   "x-data-category": "temporal",
   "format": "date-time"
  },
  "trend": {
   "type": "integer",
   "description": "Numeric trend code, written alongside `direction` by most",
   "x-sensitivity": "descriptive",
   "x-data-category": "health-derived"
  },
  "trendRate": {
   "type": "number",
   "description": "Rate of change in mg/dL/min. More precise than `direction`.",
   "x-sensitivity": "descriptive",
   "x-data-category": "health-derived"
  },
  "type": {
   "type": "string",
   "description": "Entry classification:",
   "x-sensitivity": "descriptive",
   "x-data-category": "vocabulary",
   "enum": [
    "cal",
    "mbg",
    "sgv"
   ]
  },
  "unfiltered": {
   "type": "number",
   "description": "Unfiltered raw sensor value. Used for calibration algorithms.",
   "x-sensitivity": "descriptive",
   "x-data-category": "health-measurement"
  },
  "units": {
   "type": "string",
   "description": "Glucose unit indicator.",
   "x-sensitivity": "identifying",
   "x-data-category": "vocabulary",
   "enum": [
    "mg",
    "mg/dL",
    "mg/dl",
    "mmol",
    "mmol/L"
   ]
  },
  "utcOffset": {
   "type": "integer",
   "description": "Timezone offset in minutes from UTC",
   "x-sensitivity": "quasi-identifying",
   "x-data-category": "location"
  }
 },
 "required": [
  "_id",
  "date",
  "dateString",
  "sgv",
  "sysTime",
  "type",
  "utcOffset"
 ],
 "additionalProperties": true
}
