[{"_id":"0f0f2d0c351711a38ae09d4c","type":"sgv","sgv":390,"trendRate":-1.2,"device":"Dexcom G7","trend":5,"isCalibration":false,"date":1767322876609.9592,"dateString":"2026-01-02T03:01:16.000Z","direction":"FortyFiveDown","utcOffset":0,"sysTime":"2026-01-02T03:01:16.000Z"},{"_id":"627ced39e09cef76ccecf1ce","trend":6,"device":"Dexcom G7","direction":"SingleDown","trendRate":-2.2,"type":"sgv","sgv":389,"isCalibration":false,"date":1767322576003.503,"dateString":"2026-01-02T02:56:16.000Z","utcOffset":0,"sysTime":"2026-01-02T02:56:16.000Z"},{"_id":"1b264c132767ed9284a899da","isCalibration":false,"sgv":400,"direction":"FortyFiveDown","device":"Dexcom G7","trend":5,"trendRate":-1.3,"date":1767322276016.609,"type":"sgv","dateString":"2026-01-02T02:51:16.000Z","utcOffset":0,"sysTime":"2026-01-02T02:51:16.000Z"},{"_id":"cc56198c634f0a72798c9675","isCalibration":false,"dateString":"2026-01-02T02:46:16.000Z","type":"sgv","device":"Dexcom G7","direction":"Flat","date":1767321976729.018,"trendRate":0,"sgv":400,"trend":4,"utcOffset":0,"sysTime":"2026-01-02T02:46:16.000Z"},{"_id":"223bd4dbab211467a2a56b05","isCalibration":false,"dateString":"2026-01-02T02:41:16.000Z","trendRate":-1.7,"device":"Dexcom G7","sgv":400,"direction":"FortyFiveDown","type":"sgv","date":1767321676108.615,"trend":5,"utcOffset":0,"sysTime":"2026-01-02T02:41:16.000Z"},{"_id":"0543e64bdd63e1d81cf081a2","trend":6,"trendRate":-2.6,"isCalibration":false,"dateString":"2026-01-02T02:36:16.000Z","sgv":400,"device":"Dexcom G7","type":"sgv","direction":"SingleDown","date":1767321376006.085,"utcOffset":0,"sysTime":"2026-01-02T02:36:16.000Z"},{"_id":"3487552291a9172ca1b3d89e","device":"Dexcom G7","sgv":400,"direction":"Flat","type":"sgv","dateString":"2026-01-02T02:31:16.000Z","trendRate":-0.8,"trend":4,"isCalibration":false,"date":1767321076248.9949,"utcOffset":0,"sysTime":"2026-01-02T02:31:16.000Z"},{"_id":"5d52c41fb312bbfc120df023","direction":"Flat","date":1767320776462.455,"dateString":"2026-01-02T02:26:16.000Z","device":"Dexcom G7","trend":4,"isCalibration":false,"sgv":400,"trendRate":-0.8,"type":"sgv","utcOffset":0,"sysTime":"2026-01-02T02:26:16.000Z"},{"_id":"726fda240545e0fd12a9fe0d","trend":4,"direction":"Flat","type":"sgv","sgv":400,"date":1767320476515.3188,"trendRate":-0.3,"dateString":"2026-01-02T02:21:16.000Z","device":"Dexcom G7","isCalibration":false,"utcOffset":0,"sysTime":"2026-01-02T02:21:16.000Z"},{"_id":"f49a284a98d138ddcb51a5e6","isCalibration":false,"dateString":"2026-01-02T02:16:16.000Z","type":"sgv","device":"Dexcom G7","direction":"FortyFiveDown","date":1767320176609.303,"trendRate":-1.4,"sgv":400,"trend":5,"utcOffset":0,"sysTime":"2026-01-02T02:16:16.000Z"},{"_id":"0aca2a8913727520e346dbcb","date":1767319876191.611,"trend":5,"dateString":"2026-01-02T02:11:16.000Z","device":"Dexcom G7","direction":"FortyFiveDown","sgv":400,"isCalibration":false,"trendRate":-1,"type":"sgv","utcOffset":0,"sysTime":"2026-01-02T02:11:16.000Z"},{"_id":"36457f7a36d76e4003a2e320","date":1767319576598.897,"device":"Dexcom G7","type":"sgv","isCalibration":false,"trendRate":-1.3,"direction":"FortyFiveDown","sgv":400,"dateString":"2026-01-02T02:06:16.000Z","trend":5,"utcOffset":0,"sysTime":"2026-01-02T02:06:16.000Z"},{"_id":"0fd206b297dd87ace1a9f6b1","sgv":400,"date":1767319276387.4258,"direction":"SingleDown","trendRate":-2.2,"dateString":"2026-01-02T02:01:16.000Z","type":"sgv","isCalibration":false,"device":"Dexcom G7","trend":6,"utcOffset":0,"sysTime":"2026-01-02T02:01:16.000Z"},{"_id":"3c97e70e6fc92a867c4125d8","sgv":400,"date":1767318976399.602,"type":"sgv","device":"Dexcom G7","direction":"FortyFiveDown","trendRate":-1.3,"dateString":"2026-01-02T01:56:16.000Z","trend":5,"isCalibration":false,"utcOffset":0,"sysTime":"2026-01-02T01:56:16.000Z"},{"_id":"030fdaf4dbf548458e288c89","direction":"FortyFiveDown","type":"sgv","date":1767318676682.6128,"trendRate":-1.7,"device":"Dexcom G7","sgv":400,"trend":5,"dateString":"2026-01-02T01:51:16.000Z","isCalibration":false,"utcOffset":0,"sysTime":"2026-01-02T01:51:16.000Z"},{"_id":"1e7c454877fa5e54e382f5ad","isCalibration":false,"device":"Dexcom G7","dateString":"2026-01-02T01:46:16.000Z","type":"sgv","trendRate":-1.2,"sgv":400,"date":1767318376400.838,"direction":"FortyFiveDown","trend":5,"utcOffset":0,"sysTime":"2026-01-02T01:46:16.000Z"},{"_id":"69bf91a7b4c3192883efcd3a","isCalibration":false,"dateString":"2026-01-02T01:41:16.000Z","trendRate":-2.4,"device":"Dexcom G7","sgv":400,"direction":"SingleDown","type":"sgv","date":1767318076822.788,"trend":6,"utcOffset":0,"sysTime":"2026-01-02T01:41:16.000Z"},{"_id":"965e52d162ff82b4f497702e","trend":6,"direction":"SingleDown","sgv":400,"type":"sgv","date":1767317775945.6448,"trendRate":-2.7,"device":"Dexcom G7","dateString":"2026-01-02T01:36:15.000Z","isCalibration":false,"utcOffset":0,"sysTime":"2026-01-02T01:36:15.000Z"},{"_id":"ce3339494833917bd239adb9","trend":6,"direction":"SingleDown","sgv":400,"type":"sgv","date":1767317475945.6448,"trendRate":-2.2,"device":"Dexcom G7","dateString":"2026-01-02T01:31:15.000Z","isCalibration":false,"utcOffset":0,"sysTime":"2026-01-02T01:31:15.000Z"},{"_id":"68552cdde6d6bef862acf287","trend":6,"direction":"SingleDown","device":"Dexcom G7","type":"sgv","date":1767317176128.758,"isCalibration":false,"dateString":"2026-01-02T01:26:16.000Z","sgv":400,"trendRate":-2.1,"utcOffset":0,"sysTime":"2026-01-02T01:26:16.000Z"},{"_id":"f4f56835f43e649348116edb","sgv":400,"type":"sgv","dateString":"2026-01-02T01:21:16.000Z","trend":6,"isCalibration":false,"trendRate":-2.3,"direction":"SingleDown","device":"Dexcom G7","date":1767316876772.9512,"utcOffset":0,"sysTime":"2026-01-02T01:21:16.000Z"},{"_id":"3aa917baa4901d6d3b518905","type":"sgv","sgv":400,"dateString":"2026-01-02T01:16:16.000Z","trend":6,"isCalibration":false,"trendRate":-2.5,"direction":"SingleDown","device":"Dexcom G7","date":1767316576765.9768,"utcOffset":0,"sysTime":"2026-01-02T01:16:16.000Z"},{"_id":"759aa27f77703b01974ff208","isCalibration":false,"device":"Dexcom G7","dateString":"2026-01-02T01:11:16.000Z","type":"sgv","trendRate":-3.2,"sgv":400,"date":1767316276199.69,"direction":"DoubleDown","trend":7,"utcOffset":0,"sysTime":"2026-01-02T01:11:16.000Z"},{"_id":"07c11851762588af4ddc11bb","sgv":400,"trendRate":-1.6,"date":1767315976253.353,"type":"sgv","dateString":"2026-01-02T01:06:16.000Z","isCalibration":false,"direction":"FortyFiveDown","trend":5,"device":"Dexcom G7","utcOffset":0,"sysTime":"2026-01-02T01:06:16.000Z"},{"_id":"50608cae1d6dbf366713ca2d","sgv":400,"date":1767315675967.417,"type":"sgv","device":"Dexcom G7","direction":"Flat","trendRate":0,"dateString":"2026-01-02T01:01:15.000Z","trend":4,"isCalibration":false,"utcOffset":0,"sysTime":"2026-01-02T01:01:15.000Z"},{"_id":"f24e862899c5a33b7312c1ff","dateString":"2026-01-02T00:56:16.000Z","trend":3,"device":"Dexcom G7","date":1767315376317.2651,"isCalibration":false,"trendRate":1.3,"sgv":400,"direction":"FortyFiveUp","type":"sgv","utcOffset":0,"sysTime":"2026-01-02T00:56:16.000Z"},{"_id":"7b6b81da5e6cbbc00dd3ac4f","trend":4,"type":"sgv","direction":"Flat","date":1767315076136.7412,"device":"Dexcom G7","trendRate":0.4,"dateString":"2026-01-02T00:51:16.000Z","isCalibration":false,"sgv":400,"utcOffset":0,"sysTime":"2026-01-02T00:51:16.000Z"},{"_id":"62fe2948cb852c09ab879440","device":"Dexcom G7","dateString":"2026-01-02T00:46:16.000Z","direction":"Flat","trendRate":0.3,"type":"sgv","sgv":400,"isCalibration":false,"date":1767314776727.9858,"trend":4,"utcOffset":0,"sysTime":"2026-01-02T00:46:16.000Z"},{"_id":"ada03975ac643c6e0d0e9e34","date":1767314476116.513,"trendRate":2.3,"isCalibration":false,"direction":"SingleUp","type":"sgv","trend":2,"dateString":"2026-01-02T00:41:16.000Z","sgv":400,"device":"Dexcom G7","utcOffset":0,"sysTime":"2026-01-02T00:41:16.000Z"},{"_id":"e025cfb187151ec46281090c","device":"Dexcom G7","direction":"DoubleUp","date":1767314176249.707,"sgv":400,"trendRate":3.1,"dateString":"2026-01-02T00:36:16.000Z","trend":1,"type":"sgv","isCalibration":false,"utcOffset":0,"sysTime":"2026-01-02T00:36:16.000Z"},{"_id":"b095e8fddfcc409fc4ac8596","trend":2,"isCalibration":false,"direction":"SingleUp","trendRate":2,"device":"Dexcom G7","date":1767313876128.346,"type":"sgv","sgv":400,"dateString":"2026-01-02T00:31:16.000Z","utcOffset":0,"sysTime":"2026-01-02T00:31:16.000Z"},{"_id":"e04a3cf1cbb541a1551cde8d","device":"Dexcom G7","sgv":400,"date":1767313575997.6602,"type":"sgv","trend":4,"dateString":"2026-01-02T00:26:15.000Z","direction":"Flat","isCalibration":false,"trendRate":0.2,"utcOffset":0,"sysTime":"2026-01-02T00:26:15.000Z"},{"_id":"9b83128c41958e50a6504f80","isCalibration":false,"sgv":400,"direction":"Flat","date":1767313276539.271,"device":"Dexcom G7","trend":4,"dateString":"2026-01-02T00:21:16.000Z","type":"sgv","trendRate":0.4,"utcOffset":0,"sysTime":"2026-01-02T00:21:16.000Z"},{"_id":"6dfb69f17e545567f707d9a5","isCalibration":false,"type":"sgv","date":1767312976389.626,"dateString":"2026-01-02T00:16:16.000Z","trendRate":1.6,"device":"Dexcom G7","direction":"FortyFiveUp","trend":3,"sgv":400,"utcOffset":0,"sysTime":"2026-01-02T00:16:16.000Z"},{"_id":"8487877e78a5175e0bb5200a","trendRate":2.1,"isCalibration":false,"dateString":"2026-01-02T00:11:16.000Z","date":1767312676712.6719,"direction":"SingleUp","sgv":400,"trend":2,"type":"sgv","device":"Dexcom G7","utcOffset":0,"sysTime":"2026-01-02T00:11:16.000Z"},{"_id":"c2f8f9b2673ece37ccb5342a","device":"Dexcom G7","sgv":400,"date":1767312376214.865,"type":"sgv","trend":1,"dateString":"2026-01-02T00:06:16.000Z","direction":"DoubleUp","isCalibration":false,"trendRate":3.8,"utcOffset":0,"sysTime":"2026-01-02T00:06:16.000Z"},{"_id":"1c97387133c5e60bcc9deb2e","isCalibration":false,"sgv":400,"direction":"SingleUp","date":1767312076114.746,"device":"Dexcom G7","dateString":"2026-01-02T00:01:16.000Z","type":"sgv","trend":2,"trendRate":2.9,"utcOffset":0,"sysTime":"2026-01-02T00:01:16.000Z"},{"_id":"089029787ff648608334393e","isCalibration":false,"sgv":400,"direction":"FortyFiveU